{
  "$schema": "./schema.json",
  "registryVersion": "1.0.0",
  "generatedAt": "2026-08-02",
  "methodology": {
    "capacityUnit": "decimal-gigabytes",
    "defaultReserveBasisPoints": 1300,
    "defaultAcceleratorsPerNode": 8
  },
  "sources": [
    {
      "id": "kimi-k3-github",
      "title": "Moonshot AI — Kimi K3",
      "publisher": "Moonshot AI",
      "url": "https://github.com/MoonshotAI/Kimi-K3",
      "retrievedAt": "2026-08-02"
    },
    {
      "id": "kimi-k3-config",
      "title": "Kimi K3 pinned config",
      "publisher": "Moonshot AI / Hugging Face",
      "url": "https://huggingface.co/moonshotai/Kimi-K3/blob/9f62e4e9fffbd0a83ddd60e1c209d828994b3569/config.json",
      "retrievedAt": "2026-08-02"
    },
    {
      "id": "kimi-k3-manifest",
      "title": "Kimi K3 pinned tensor manifest",
      "publisher": "Moonshot AI / Hugging Face",
      "url": "https://huggingface.co/moonshotai/Kimi-K3/blob/9f62e4e9fffbd0a83ddd60e1c209d828994b3569/model.safetensors.index.json",
      "retrievedAt": "2026-08-02"
    },
    {
      "id": "deepseek-v4-release",
      "title": "DeepSeek V4 Pro release",
      "publisher": "DeepSeek",
      "url": "https://api-docs.deepseek.com/news/news260424",
      "retrievedAt": "2026-08-02"
    },
    {
      "id": "deepseek-v4-config",
      "title": "DeepSeek V4 Pro pinned config",
      "publisher": "DeepSeek / Hugging Face",
      "url": "https://huggingface.co/deepseek-ai/DeepSeek-V4-Pro/blob/b5968e9190ef611bbf34a7229255be88a0e937c1/config.json",
      "retrievedAt": "2026-08-02"
    },
    {
      "id": "deepseek-v4-manifest",
      "title": "DeepSeek V4 Pro pinned tensor manifest",
      "publisher": "DeepSeek / Hugging Face",
      "url": "https://huggingface.co/deepseek-ai/DeepSeek-V4-Pro/blob/b5968e9190ef611bbf34a7229255be88a0e937c1/model.safetensors.index.json",
      "retrievedAt": "2026-08-02"
    },
    {
      "id": "glm-5-2-release",
      "title": "GLM-5.2 release",
      "publisher": "Z.ai",
      "url": "https://z.ai/blog/glm-5.2",
      "retrievedAt": "2026-08-02"
    },
    {
      "id": "glm-5-2-config",
      "title": "GLM-5.2 pinned config",
      "publisher": "Z.ai / Hugging Face",
      "url": "https://huggingface.co/zai-org/GLM-5.2/blob/b4734de4facf877f85769a911abafc5283eab3d9/config.json",
      "retrievedAt": "2026-08-02"
    },
    {
      "id": "glm-5-2-manifest",
      "title": "GLM-5.2 pinned tensor manifest",
      "publisher": "Z.ai / Hugging Face",
      "url": "https://huggingface.co/zai-org/GLM-5.2/blob/b4734de4facf877f85769a911abafc5283eab3d9/model.safetensors.index.json",
      "retrievedAt": "2026-08-02"
    },
    {
      "id": "gemma-4-release",
      "title": "Google introduces Gemma 4",
      "publisher": "Google",
      "url": "https://blog.google/innovation-and-ai/technology/developers-tools/gemma-4/",
      "retrievedAt": "2026-08-02"
    },
    {
      "id": "gemma-4-config",
      "title": "Gemma 4 26B A4B IT pinned config",
      "publisher": "Google / Hugging Face",
      "url": "https://huggingface.co/google/gemma-4-26B-A4B-it/blob/4d7ae4984b7db7de8f8457170b3f1a419ee76d52/config.json",
      "retrievedAt": "2026-08-02"
    },
    {
      "id": "gemma-4-manifest",
      "title": "Gemma 4 26B A4B IT pinned tensor manifest",
      "publisher": "Google / Hugging Face",
      "url": "https://huggingface.co/google/gemma-4-26B-A4B-it/blob/4d7ae4984b7db7de8f8457170b3f1a419ee76d52/model.safetensors.index.json",
      "retrievedAt": "2026-08-02"
    },
    {
      "id": "gemma-4-readme",
      "title": "Gemma 4 26B A4B IT pinned model card",
      "publisher": "Google / Hugging Face",
      "url": "https://huggingface.co/google/gemma-4-26B-A4B-it/blob/4d7ae4984b7db7de8f8457170b3f1a419ee76d52/README.md",
      "retrievedAt": "2026-08-02"
    },
    {
      "id": "qwen3-github",
      "title": "Qwen3",
      "publisher": "Qwen Team",
      "url": "https://github.com/QwenLM/Qwen3",
      "retrievedAt": "2026-08-02"
    },
    {
      "id": "qwen3-model-card",
      "title": "Qwen3-30B-A3B pinned model card",
      "publisher": "Qwen Team / Hugging Face",
      "url": "https://huggingface.co/Qwen/Qwen3-30B-A3B/tree/ad44e777bcd18fa416d9da3bd8f70d33ebb85d39",
      "retrievedAt": "2026-08-02"
    },
    {
      "id": "qwen3-config",
      "title": "Qwen3-30B-A3B pinned config",
      "publisher": "Qwen Team / Hugging Face",
      "url": "https://huggingface.co/Qwen/Qwen3-30B-A3B/blob/ad44e777bcd18fa416d9da3bd8f70d33ebb85d39/config.json",
      "retrievedAt": "2026-08-02"
    },
    {
      "id": "qwen3-manifest",
      "title": "Qwen3-30B-A3B pinned tensor manifest",
      "publisher": "Qwen Team / Hugging Face",
      "url": "https://huggingface.co/Qwen/Qwen3-30B-A3B/blob/ad44e777bcd18fa416d9da3bd8f70d33ebb85d39/model.safetensors.index.json",
      "retrievedAt": "2026-08-02"
    },
    {
      "id": "nvidia-h200",
      "title": "NVIDIA H200 Tensor Core GPU",
      "publisher": "NVIDIA",
      "url": "https://www.nvidia.com/en-us/data-center/h200/",
      "retrievedAt": "2026-08-02"
    },
    {
      "id": "nvidia-h100",
      "title": "NVIDIA H100 Tensor Core GPU",
      "publisher": "NVIDIA",
      "url": "https://www.nvidia.com/en-us/data-center/h100/",
      "retrievedAt": "2026-08-02"
    },
    {
      "id": "nvidia-a100",
      "title": "NVIDIA A100 Tensor Core GPU",
      "publisher": "NVIDIA",
      "url": "https://www.nvidia.com/content/dam/en-zz/Solutions/Data-Center/a100/pdf/nvidia-a100-datasheet-nvidia-us-2188504-web.pdf",
      "retrievedAt": "2026-08-02"
    },
    {
      "id": "nvidia-rtx-6000-ada",
      "title": "NVIDIA RTX 6000 Ada Generation",
      "publisher": "NVIDIA",
      "url": "https://www.nvidia.com/en-us/products/workstations/rtx-6000/",
      "retrievedAt": "2026-08-02"
    }
  ],
  "models": [
    {
      "id": "kimi-k3",
      "name": "Kimi K3",
      "provider": "Moonshot AI",
      "provenance": [
        { "sourceId": "kimi-k3-github" }
      ],
      "artifact": {
        "repository": "moonshotai/Kimi-K3",
        "revision": "9f62e4e9fffbd0a83ddd60e1c209d828994b3569",
        "format": "safetensors",
        "manifestUrl": "https://huggingface.co/moonshotai/Kimi-K3/blob/9f62e4e9fffbd0a83ddd60e1c209d828994b3569/model.safetensors.index.json",
        "provenance": [
          { "sourceId": "kimi-k3-config", "locator": "pinned revision" },
          { "sourceId": "kimi-k3-manifest", "locator": "safetensors artifact manifest" }
        ]
      },
      "claims": {
        "totalParameters": {
          "status": "known",
          "value": 2800000000000,
          "provenance": [{ "sourceId": "kimi-k3-github", "locator": "model architecture" }]
        },
        "activeParameters": {
          "status": "known",
          "value": 104000000000,
          "provenance": [{ "sourceId": "kimi-k3-github", "locator": "model architecture" }]
        },
        "artifactTensorBytes": {
          "status": "known",
          "value": 1560860324864,
          "provenance": [{ "sourceId": "kimi-k3-manifest", "locator": "metadata.total_size" }]
        },
        "contextTokens": {
          "status": "known",
          "value": 1048576,
          "provenance": [{ "sourceId": "kimi-k3-config", "locator": "text_config.max_position_embeddings" }]
        },
        "routedExperts": {
          "status": "known",
          "value": 896,
          "provenance": [{ "sourceId": "kimi-k3-config", "locator": "text_config.num_experts" }]
        },
        "expertsPerToken": {
          "status": "known",
          "value": 16,
          "provenance": [{ "sourceId": "kimi-k3-config", "locator": "text_config.num_experts_per_token" }]
        },
        "nativeWeightFormat": {
          "status": "known",
          "value": "MXFP4",
          "provenance": [{ "sourceId": "kimi-k3-github", "locator": "checkpoint format" }]
        },
        "license": {
          "status": "unknown",
          "reason": "A checkpoint license identifier was not verified in this registry revision.",
          "provenance": [{ "sourceId": "kimi-k3-github" }]
        }
      }
    },
    {
      "id": "deepseek-v4-pro",
      "name": "DeepSeek V4 Pro",
      "provider": "DeepSeek",
      "provenance": [{ "sourceId": "deepseek-v4-release" }],
      "artifact": {
        "repository": "deepseek-ai/DeepSeek-V4-Pro",
        "revision": "b5968e9190ef611bbf34a7229255be88a0e937c1",
        "format": "safetensors",
        "manifestUrl": "https://huggingface.co/deepseek-ai/DeepSeek-V4-Pro/blob/b5968e9190ef611bbf34a7229255be88a0e937c1/model.safetensors.index.json",
        "provenance": [
          { "sourceId": "deepseek-v4-config", "locator": "pinned revision" },
          { "sourceId": "deepseek-v4-manifest", "locator": "safetensors artifact manifest" }
        ]
      },
      "claims": {
        "totalParameters": {
          "status": "known",
          "value": 1600000000000,
          "provenance": [{ "sourceId": "deepseek-v4-release", "locator": "model architecture" }]
        },
        "activeParameters": {
          "status": "known",
          "value": 49000000000,
          "provenance": [{ "sourceId": "deepseek-v4-release", "locator": "model architecture" }]
        },
        "artifactTensorBytes": {
          "status": "known",
          "value": 864704792696,
          "provenance": [{ "sourceId": "deepseek-v4-manifest", "locator": "metadata.total_size" }]
        },
        "contextTokens": {
          "status": "known",
          "value": 1048576,
          "provenance": [{ "sourceId": "deepseek-v4-config", "locator": "max_position_embeddings" }]
        },
        "routedExperts": {
          "status": "known",
          "value": 384,
          "provenance": [{ "sourceId": "deepseek-v4-config", "locator": "n_routed_experts" }]
        },
        "expertsPerToken": {
          "status": "known",
          "value": 6,
          "provenance": [{ "sourceId": "deepseek-v4-config", "locator": "num_experts_per_tok" }]